{
  "datasetVersion": "1.0.0",
  "schemaVersion": "1.1.0",
  "citation": "Prismatic Labs (2026). Culm AI Stack Concentration Map v1.0.0. Dataset snapshot culm-concentration-2026-10-05.json.",
  "layers": [
    {
      "id": "critical-materials",
      "name": "Critical Materials & Inputs",
      "stackOrder": 1,
      "category": "Materials",
      "whatItIs": "Photoresists, ultrapure silica wafers, specialty gases, and critical elements such as gallium and germanium.",
      "whyItMatters": "Several inputs are single-country dependencies. Without them, several downstream layers would stall, often before the bottleneck most people have heard of. Each input below has its own dominant country.",
      "stallEffect": "Without these inputs, wafer and lithography supply chains halt before fabs can run.",
      "actors": [
        {
          "name": "China (primary gallium production)",
          "country": "China",
          "share": {
            "value": 0.99,
            "confidence": "high",
            "asOf": "2025",
            "sources": [
              "https://pubs.usgs.gov/periodicals/mcs2026/mcs2026-gallium.pdf"
            ],
            "note": "USGS MCS 2026: China accounted for 99% of worldwide primary low-purity gallium production. This is refining/recovery capacity (gallium is a byproduct of alumina refining), not ore reserves."
          }
        },
        {
          "name": "JSR + TOK + Shin-Etsu (photoresists)",
          "country": "Japan",
          "share": {
            "value": 0.5,
            "confidence": "medium",
            "asOf": "2024",
            "sources": [
              "https://www.brookings.edu/articles/the-renaissance-of-the-japanese-semiconductor-industry/"
            ],
            "note": "Brookings: Japan ~50% of global photoresist supply (all types). Industry reports put the EUV segment higher, but without a citable figure."
          }
        },
        {
          "name": "Shin-Etsu + SUMCO (silicon wafers)",
          "country": "Japan",
          "share": {
            "value": 0.53,
            "confidence": "medium",
            "asOf": "2024",
            "sources": [
              "https://www.brookings.edu/articles/the-renaissance-of-the-japanese-semiconductor-industry/"
            ],
            "note": "Brookings: Japan 53% global silicon wafer share."
          }
        }
      ],
      "metrics": {
        "cr1": {
          "value": 0.99,
          "confidence": "high",
          "asOf": "2025",
          "sources": [
            "https://pubs.usgs.gov/periodicals/mcs2026/mcs2026-gallium.pdf"
          ],
          "note": "Layer headline CR1 uses gallium primary production, the tightest single-country input in this layer.",
          "caveat": "China suspended its ban on gallium exports to the US for one year in November 2025 (USGS MCS 2026); the acute export lever is temporarily relaxed, but the structural refining concentration is unchanged."
        },
        "cr3": {
          "value": 0.99,
          "confidence": "medium",
          "asOf": "2025",
          "sources": [
            "https://pubs.usgs.gov/periodicals/mcs2026/mcs2026-gallium.pdf",
            "https://www.brookings.edu/articles/the-renaissance-of-the-japanese-semiconductor-industry/"
          ],
          "note": "Composite layer; CR3 not additive across sub-materials. Shown for transparency."
        },
        "hhi": {
          "value": 9801,
          "confidence": "medium",
          "asOf": "2025",
          "sources": [
            "https://pubs.usgs.gov/periodicals/mcs2026/mcs2026-gallium.pdf"
          ],
          "note": "Gallium country concentration: China 99% gives 99² = 9,801."
        },
        "topCountry": "China",
        "topCountryShare": {
          "value": 0.99,
          "confidence": "high",
          "asOf": "2025",
          "sources": [
            "https://pubs.usgs.gov/periodicals/mcs2026/mcs2026-gallium.pdf"
          ],
          "note": "Gallium refining. Japan dominates photoresist/wafers separately. See actors."
        },
        "dominantCountries": [
          {
            "country": "China",
            "share": {
              "value": 0.99,
              "confidence": "high",
              "asOf": "2025",
              "sources": [
                "https://pubs.usgs.gov/periodicals/mcs2026/mcs2026-gallium.pdf"
              ],
              "note": "USGS MCS 2026: China 99% of worldwide primary low-purity gallium production. Gallium feeds gallium-arsenide and gallium-nitride chips used in radio-frequency, power-electronics, and optoelectronic devices."
            }
          },
          {
            "country": "Japan",
            "share": {
              "value": 0.53,
              "confidence": "medium",
              "asOf": "2024",
              "sources": [
                "https://www.brookings.edu/articles/the-renaissance-of-the-japanese-semiconductor-industry/"
              ],
              "note": "Brookings: Japan 53% of silicon wafers and ~50% of photoresists."
            }
          }
        ],
        "substitutability": {
          "value": "years",
          "confidence": "medium",
          "asOf": "2025",
          "sources": [
            "https://pubs.usgs.gov/periodicals/mcs2026/mcs2026-gallium.pdf",
            "https://www.brookings.edu/articles/the-renaissance-of-the-japanese-semiconductor-industry/"
          ],
          "note": "USGS notes limited substitutes for germanium in some uses; gallium refinery buildout measured in years."
        }
      },
      "subcomponents": [
        {
          "id": "gallium",
          "name": "Primary gallium production",
          "country": "China",
          "share": {
            "value": 0.99,
            "confidence": "high",
            "asOf": "2025",
            "sources": [
              "https://pubs.usgs.gov/periodicals/mcs2026/mcs2026-gallium.pdf"
            ],
            "note": "USGS MCS 2026: China 99% of worldwide primary low-purity gallium production (refining capacity, not reserves). Drives headline CR1."
          }
        },
        {
          "id": "germanium",
          "name": "Primary germanium production",
          "country": "China",
          "share": {
            "value": 0.68,
            "confidence": "medium",
            "asOf": "2021",
            "sources": [
              "https://pubs.usgs.gov/periodicals/mcs2022/mcs2022-germanium.pdf",
              "https://pubs.usgs.gov/periodicals/mcs2026/mcs2026-germanium.pdf"
            ],
            "note": "USGS MCS 2022 world refinery production (the last edition with a country table): China 95,000 kg of 140,000 kg world total for 2021 ≈ 68%. USGS reported the country figure as \"NA\" from MCS 2023 and dropped the table entirely by MCS 2024; MCS 2026 still names China the leading global producer but publishes no share. The widely cited \"~60%\" understates this last USGS figure.",
            "caveat": "Latest USGS-tabulated share is 2021 data; US production is withheld (W) in the table, and no current USGS percentage exists."
          }
        },
        {
          "id": "euv-photoresist",
          "name": "Photoresists (JSR, TOK, Shin-Etsu)",
          "country": "Japan",
          "share": {
            "value": 0.5,
            "confidence": "medium",
            "asOf": "2024",
            "sources": [
              "https://www.brookings.edu/articles/the-renaissance-of-the-japanese-semiconductor-industry/"
            ],
            "note": "Brookings: Japan ~50% of global photoresist supply (all types)."
          }
        },
        {
          "id": "silicon-wafers",
          "name": "Silicon wafers (Shin-Etsu, SUMCO)",
          "country": "Japan",
          "share": {
            "value": 0.53,
            "confidence": "medium",
            "asOf": "2024",
            "sources": [
              "https://www.brookings.edu/articles/the-renaissance-of-the-japanese-semiconductor-industry/"
            ],
            "note": "Japan 53% global wafer share. Below 80% alone; shown for transparency."
          }
        }
      ],
      "dependsOn": [],
      "isCriticalChokepoint": true,
      "chokepointRationale": "Composite layer with 2 map geographies. Qualifies because CR1 ≈ 99%; top-country share ≈ 99%; substitutability is years. Layer headline CR1 uses gallium primary production, the tightest single-country input in this layer."
    },
    {
      "id": "euv-litho",
      "name": "EUV Lithography",
      "stackOrder": 2,
      "category": "Equipment",
      "whatItIs": "The machines that print the finest circuit patterns using extreme-ultraviolet light. No leading-edge AI chip can be made at current densities without them.",
      "whyItMatters": "ASML is the sole commercial supplier of EUV lithography systems in current data, and each machine depends on a thin chain of sub-suppliers. Among the most concentrated layers in this dataset.",
      "stallEffect": "Leading-edge chip patterning would be severely constrained; advanced-node production at current densities would stall.",
      "actors": [
        {
          "name": "ASML",
          "country": "Netherlands",
          "share": {
            "value": 1,
            "confidence": "high",
            "asOf": "2025",
            "sources": [
              "https://www.asml.com/en/products/euv-lithography-systems",
              "https://www.ft.com/content/e47375fb-8c9f-4a4f-8526-8d46ededb805"
            ],
            "note": "Sole commercial EUV lithography system supplier."
          }
        }
      ],
      "metrics": {
        "cr1": {
          "value": 1,
          "confidence": "high",
          "asOf": "2025",
          "sources": [
            "https://www.asml.com/en/products/euv-lithography-systems",
            "https://www.ft.com/content/e47375fb-8c9f-4a4f-8526-8d46ededb805"
          ]
        },
        "cr3": {
          "value": 1,
          "confidence": "high",